"MO-DDPG: An Affinity and Anti-Affinity-Based Container Service Migration Strategy in MEC","Q. Deng; S. Zhang; X. Yang; Q. Zuo; Z. Wang; S. Long","School of Computer Science and Engineering and the School of Software, Guangxi Normal University, Guilin, China; School of Computer Science and Engineering and the School of Software, Guangxi Normal University, Guilin, China; School of Computer Science and Engineering and the School of Software, Guangxi Normal University, Guilin, China; School of Computer Science and Engineering and the School of Software, Guangxi Normal University, Guilin, China; College of Information Science and Technology, Jinan University, Guangzhou, China; College of Information Science and Technology, Jinan University, Guangzhou, China",2024 IEEE International Conference on High Performance Computing and Communications (HPCC),"23 Jul 2025","2024","","","618","626","The time-varying characteristics of user mobility, node and services connections, and edge resources in Mobile Edge Computing (MEC) scenarios pose significant challenges for designing efficient service migration strategies to enhance system performance. This paper introduces and quantifies affinity and anti-affinity metrics to evaluate the discrepancies between the resource requirements of containers and the available resources of nodes, as well as the competition level of computing resources during the migration of containers among different nodes within the Kubernetes cluster. To adapt to the complexity of the edge environment, such metrics are integrated into the reward update mechanism of the Deep Deterministic Policy Gradient (DDPG) reinforcement algorithm. Besides, the Multi-Objective Evolutionary Algorithm (MOEA) is employed to dynamically adjust the weights of various reward objectives, forming a self-adaptive online container migration strategy named MO-DDPG. Finally, we construct a real-world heterogeneous Kubernetes edge node cluster in experiments and use a public dataset to simulate multi-modal connections between mobile user trajectories and service demands. Compared to the greedy and heuristic strategies that consider only single metrics, our experiment results show that the proposed strategy improves energy efficiency and reduces latency by 21.30% and 29.49%, respectively. Moreover, the MO-DDPG improves resource utilization of the node cluster compared to the default Kubernetes scheduler.","","979-8-3315-4046-3","10.1109/HPCC64274.2024.00088","National Natural Science Foundation of China; ","https://ieeexplore.ieee.org/stamp/stamp.jsp?arnumber=11083178","Mobile Edge Computing;service migration;Kubernetes;DDPG;MOEA;resource utilization","Measurement;Multi-access edge computing;System performance;High performance computing;Heuristic algorithms;Focusing;Containers;Trajectory;Resource management;Time-varying systems","","","","32","IEEE","23 Jul 2025","","","IEEE","IEEE Conferences"
"A Monitoring, Observability and Analytics Framework to Improve the Sustainability of B5G Technologies","M. Akbari; R. Bolla; R. Bruschi; F. Davoli; C. Lombardo; B. Siccardi","DITEN, University of Genoa, Genoa, Italy; DITEN, S2N National Lab, University of Genoa, CNIT, Genoa, Italy; DITEN, S2N National Lab, University of Genoa, CNIT, Genoa, Italy; DITEN, S2N National Lab, University of Genoa, CNIT, Genoa, Italy; DITEN, S2N National Lab, University of Genoa, CNIT, Genoa, Italy; DITEN, University of Genoa, Genoa, Italy",2024 IEEE International Conference on Communications Workshops (ICC Workshops),"12 Aug 2024","2024","","","969","975","As mobile generations advance, blurring the lines between physical and digital worlds, the deployment of ultra-dense networks poses challenges in resource allocation and energy efficiency. This article revolves around the environmental sustainability of Fifth Generation (5G) and Beyond 5G (B5G) mobile networks as cloud-native technologies, highlighting the use phase. It aims to represent a monitoring, observability and analytical framework to devise a feature selection methodology within well-known monitoring tools, aligning with environmental sustainability objectives. Notable open-source monitoring applications (e.g., Kepler and Scaphandre) are employed to collect data on resource utilization and energy consumption for containers and physical servers. Dependence criteria indexes, Hilbert-Schmidt Independence Criterion (HSIC) and Pearson, identify interdependencies among timeseries from different tools. Addressing challenges, the paper resolves inconsistent dataset lengths, highlights the Pearson-HSIC trade-off, and underscores the need for alignment in feature selection with compatibility to resource utilization. Key findings include Scaphandre's underestimation of memory impact on power consumption, Kepler's limitations in host metrics. Finally, the results enable the development of an anomaly detection mechanism.","2694-2941","979-8-3503-0405-3","10.1109/ICCWorkshops59551.2024.10615948","","https://ieeexplore.ieee.org/stamp/stamp.jsp?arnumber=10615948","B5G;monitoring;observability;energy efficiency;feature reduction;anomaly detection","Measurement;Power demand;Memory management;Containers;Feature extraction;Resource management;Servers","","5","","31","IEEE","12 Aug 2024","","","IEEE","IEEE Conferences"
"Multi-Application Hierarchical Autoscaling for Kubernetes Edge Clusters","I. Dimolitsas; D. Spatharakis; D. Dechouniotis; A. Zafeiropoulos; S. Papavassiliou","School of Electrical and Computer Engineering, National Technical University of Athens, Athens, Greece; School of Electrical and Computer Engineering, National Technical University of Athens, Athens, Greece; School of Electrical and Computer Engineering, National Technical University of Athens, Athens, Greece; School of Electrical and Computer Engineering, National Technical University of Athens, Athens, Greece; School of Electrical and Computer Engineering, National Technical University of Athens, Athens, Greece",2023 IEEE International Conference on Smart Computing (SMARTCOMP),"7 Aug 2023","2023","","","291","296","The dynamic workload demands of smart city applications hosted on edge infrastructures require the development of advanced scaling mechanisms. Recent studies proposed single-application autoscaling solutions based on various technical approaches. However, for edge infrastructures with limited resource availability, it is essential to simultaneously manage heterogeneous application requirements, aiming at optimal resource allocation and minimal operational costs. This study introduces a multi-application hierarchical autoscaling framework for Kubernetes Edge Clusters. An application-based mechanism nominates the best applications’ deployments based on workload prediction and several criteria that guarantee the application’s performance while minimizing the infrastructure provider’s cost. For the joint application orchestration, an aggregation mechanism composes the candidate scaling solutions for the cluster. Then, a cluster autoscaling mechanism, based on the Analytic Hierarchy Process, undertakes the cluster’s scaling decision to optimize the resource allocation and energy consumption of the cluster. The evaluation illustrates the benefits of the proposed scaling strategy, achieving significant improvement in the average allocated resources and energy consumption compared to single-application approaches.","2693-8340","979-8-3503-2281-1","10.1109/SMARTCOMP58114.2023.00074","","https://ieeexplore.ieee.org/stamp/stamp.jsp?arnumber=10207647","","Energy consumption;Costs;Smart cities;Analytic hierarchy process;Resource management","","4","","18","IEEE","7 Aug 2023","","","IEEE","IEEE Conferences"
"Temporal Knowledge Graph Construction for microservice-based digital power applications","J. Zhang; Y. Wang; Z. Liang; M. Zheng; L. Xie; J. Cui","Information Center Guangdong Power Grid, Guangzhou, China; Information Center Guangdong Power Grid, Guangzhou, China; Information Center Guangdong Power Grid, Guangzhou, China; Institute of Software Chinese Academy of Sciences, Beijing, China; Institute of Software Chinese Academy of Sciences, Beijing, China; Institute of Software Chinese Academy of Sciences, Beijing, China","2025 8th International Conference on Energy, Electrical and Power Engineering (CEEPE)","18 Jun 2025","2025","","","220","226","Modern digital power systems increasingly adopt microservices to enhance flexibility and scalability. However, in cloud-native environments, dynamic interactions across the microservices, Kubernetes, and physical machine layers complicate system monitoring and fault diagnosis. Key challenges include real-time high-frequency data collection, semantic integration of heterogeneous data, and incremental updates to knowledge graphs. This paper proposes constructing a multi-dimensional temporal knowledge graph by collecting logs, metrics, and traces from power systems and employing semantic models to unify data entities and relationships. A real-time incremental update mechanism significantly improves the efficiency of online monitoring and fault diagnosis in large-scale power systems.","","979-8-3315-2184-4","10.1109/CEEPE64987.2025.11033891","National Natural Science Foundation of China; Chinese Academy of Sciences; ","https://ieeexplore.ieee.org/stamp/stamp.jsp?arnumber=11033891","Digital power systems;Microservices;Temporal knowledge graph;Cloud-native;Real-time monitoring","Fault diagnosis;Measurement;Power engineering;Scalability;Semantics;Power system dynamics;Microservice architectures;Knowledge graphs;Real-time systems;Monitoring","","","","12","IEEE","18 Jun 2025","","","IEEE","IEEE Conferences"
"A Comprehensive Modeling and Scheduling Approach for Allocating Distributed Multi-Robot Software to the Edge/Cloud","Y. Zhang; F. Mirus; F. Pasch; K. -U. Scholl; C. Wurll; B. Hein","Karlsruhe University of Applied Sciences, Karlsruhe, Germany; Intel Labs, Karlsruhe, Germany; Intel Labs, Karlsruhe, Germany; Intel Labs, Karlsruhe, Germany; Karlsruhe University of Applied Sciences, Karlsruhe, Germany; Karlsruhe University of Applied Sciences, Karlsruhe, Germany",2024 IEEE/RSJ International Conference on Intelligent Robots and Systems (IROS),"25 Dec 2024","2024","","","5799","5806","Offloading software modules to the edge/cloud can enhance a robot’s capabilities by leveraging massive computing power. However, determining which software module should be offloaded and scheduled to which robot/edge/cloud node is a challenging task, particularly for robot fleets with diverse tasks. In this paper, we tackle the software scheduling problem and introduce a taxonomy to categorize software modules and classify their applicability and requirements for offloading. Additionally, by using prior measurements, we model the compute cluster and formalize software scheduling as a multi-objective optimization problem which we tackle with a genetic algorithm. To evaluate our approach with a challenging setup, we build a mobile manipulation task using open-source frameworks and libraries in the Robot Operating System (ROS2) community in simulation as well as a mildly simplified real-world variant. Our evaluation shows significant improvements compared to the built-in scheduler of Kubernetes (K8s) regarding robotic specific metrics such as the rate of missed cycle time in both simulated and real-world experiments.","2153-0866","979-8-3503-7770-5","10.1109/IROS58592.2024.10802443","Ministry of Education; ","https://ieeexplore.ieee.org/stamp/stamp.jsp?arnumber=10802443","","Costs;Processor scheduling;Computational modeling;Taxonomy;Software;Time measurement;Software measurement;Robots;Optimization;Genetic algorithms","","1","","39","IEEE","25 Dec 2024","","","IEEE","IEEE Conferences"
"Directives for Function Offloading in 5G Networks Based on a Performance Characteristics Analysis","F. Dettinger; M. Weiß; M. Weyrich; D. Baumann; M. Sommer","Institute of Industrial Automation and Software (IAS), University of Stuttgart, Pfaffenwaldring 47, Stuttgart, Germany; Institute of Industrial Automation and Software (IAS), University of Stuttgart, Pfaffenwaldring 47, Stuttgart, Germany; Institute of Industrial Automation and Software (IAS), University of Stuttgart, Pfaffenwaldring 47, Stuttgart, Germany; Institut fuer Technik der Informationsverarbeitung (ITIV), Karlsruhe Institute of Technology (KIT), Engesserstr. 5, Karlsruhe, Germany; Institut fuer Technik der Informationsverarbeitung (ITIV), Karlsruhe Institute of Technology (KIT), Engesserstr. 5, Karlsruhe, Germany",2025 IEEE International Automated Vehicle Validation Conference (IAVVC),"11 Nov 2025","2025","","","1","8","Cloud-based offloading helps address energy consumption and performance challenges in executing resourceintensive vehicle algorithms. Utilizing 5G, with its low latency and high bandwidth, enables seamless vehicle-to-cloud integration. Currently, only non-standalone 5G is publicly available, and realworld applications remain underexplored compared to theoretical studies. This paper evaluates 5G non-standalone networks for cloud execution of vehicle functions, focusing on latency, Round Trip Time, and packet delivery. Tests used two AI-based algorithms—emotion recognition and object recognition—along an 8.8 km route in Baden-Württemberg, Germany, encompassing urban, rural, and forested areas. Two platforms were analyzed: a cloudlet in Frankfurt and a cloud in Mannheim, employing various deployment strategies like conventional applications and containerized and container-orchestrated setups. Key findings highlight an average signal quality of 84 %, with no connectivity interruptions despite minor drops in built-up areas. Packet analysis revealed a Packet Error Rate below 0.1 % for both algorithms. Transfer times varied significantly depending on the geographical location and the backend servers' network connections, while processing times were mainly influenced by the computation hardware in use. Additionally, cloud offloading seems only be a suitable option, when a round trip time of more than 150 ms is possible.","","979-8-3315-2526-2","10.1109/IAVVC61942.2025.11219471","Chips Joint Undertaking; ","https://ieeexplore.ieee.org/stamp/stamp.jsp?arnumber=11219471","5G non-stand alone;Bandwidth;Cloud Offloading;Function Offloading;Latency;Performance Characteristics Analysis","Visualization;5G mobile communication;Current measurement;Bandwidth;Routing;Performance metrics;Hardware;Time measurement;Servers;Long Term Evolution","","","","31","IEEE","11 Nov 2025","","","IEEE","IEEE Conferences"
"Analysis of Building Model Forecasts using Autonomous HVAC Optimization System for Residential Neighborhood","V. Lebakula; H. Zandi; C. Winstead; E. Tsybina; T. Kuruganti; J. Hill","Geospatial Science and Human Security Division, Oak Ridge National Laboratory, Oak Ridge, USA; Computational Sciences and Engineering Division, Oak Ridge National Laboratory, Oak Ridge, USA; Computational Sciences and Engineering Division, Oak Ridge National Laboratory, Oak Ridge, USA; Energy Science and Technology Directorate, Oak Ridge National Laboratory, Oak Ridge, USA; Computational Sciences and Engineering Division, Oak Ridge National Laboratory, Oak Ridge, USA; Southern Company, Birmingham, USA",2023 IEEE Energy Conversion Congress and Exposition (ECCE),"29 Dec 2023","2023","","","1218","1224","Heating, ventilation, and air conditioning (HVAC) systems account for the highest share of home energy consumption in the United States. Optimized HVAC control can provide thermal improved comfort to the occupants, improve energy efficiency, reduce energy cost, and support grid services. In this paper, we discuss a multi-agent and cloud-based software framework that has been deployed in occupied residential neighborhood. This system enables automatic data collection, learning, optimization, and dispatches signals to neighborhood devices. HVAC optimization is based on model predictive control (MPC). Since the operational performance of MPC depends on model forecasting accuracy, it is crucial to evaluate the model continuously and modify or retrain it as necessary. In this research, we developed an automated workflow to evaluate the performance of temperature and power forecasts based on measured data in the real world. This will provide researchers with a deeper understanding of the model and how it can be improved.","2329-3748","979-8-3503-1644-5","10.1109/ECCE53617.2023.10362041","Battelle; ","https://ieeexplore.ieee.org/stamp/stamp.jsp?arnumber=10362041","MPC;HVAC;docker;zone level analysis;residential neighborhood","Temperature measurement;Performance evaluation;Analytical models;HVAC;Clouds;Buildings;Predictive models","","5","","21","IEEE","29 Dec 2023","","","IEEE","IEEE Conferences"
"Towards a Framework for Monitoring and Analyzing High Performance Computing Environments Using Kubernetes and Prometheus","N. Sukhija; E. Bautista","Department of Computer Science, Slippery Rock University of Pennsylvania, USA; Lawrence Berkeley National Laboratory, NERSC, Berkeley, USA","2019 IEEE SmartWorld, Ubiquitous Intelligence & Computing, Advanced & Trusted Computing, Scalable Computing & Communications, Cloud & Big Data Computing, Internet of People and Smart City Innovation (SmartWorld/SCALCOM/UIC/ATC/CBDCom/IOP/SCI)","9 Apr 2020","2019","","","257","262","The challenge of monitoring a computational center grows as the center deploys larger and more diverse systems. As system size grows, it becomes harder to discern the problem from the noise. Staff often experience alert fatigue, an occurrence when so many alerts come in that the actual problem is obscured by false alarms or by alarms for issues that are symptoms of the core problem. The National Energy Research Scientific Computing Center (NERSC) at the Lawrence Berkeley National Laboratory (LBNL) has begun to address this issue by ensuring that most alerts are actionable and that multiple alerts for common problems, such as node outages, do not arise. However, more work is needed for these solutions to be extensible to emerging extreme-scale systems. In this paper, we propose a framework for proactively monitoring and managing data center operations, capable of scaling to accommodate the heterogeneity and complexity of next-generation systems. We describe a new architecture for the Operations Monitoring and Notification Infrastructure (OMNI) at NERSC that enables proactive monitoring and management at scale by integrating state-of-the-art technology, such as Kubernetes, Prometheus, Grafana, and other predictive platforms with data from metrics, sensors, and analytics engines. The system will support the operation of the upcoming Perlmutter HPC system, to be delivered in late 2020, as well as NERSC's successive computational system deployments. This comprehensive infrastructure will assist in centrally orchestrating services and deployments, automatically analyzing streaming data, correlating multiple-sourced data, and thresholding alerts to identify core issues from a single view.","","978-1-7281-4034-6","10.1109/SmartWorld-UIC-ATC-SCALCOM-IOP-SCI.2019.00087","","https://ieeexplore.ieee.org/stamp/stamp.jsp?arnumber=9060302","HPC;Data Monitoring;Kubernetes;Prometheus;Grafana;Predictive;Visualization","Monitoring;Data centers;Tools;Market research;Measurement;Organizations;Hardware","","40","","28","IEEE","9 Apr 2020","","","IEEE","IEEE Conferences"
"ELK Stack – Improving the Computing Clusters at DFCTI Through Log Analysis","R. Poenaru; D. Ciobanu-Zabet","DFCTI, IFIN-HH, Magurele, Romania; DFCTI, IFIN-HH, Magurele, Romania",2020 19th RoEduNet Conference: Networking in Education and Research (RoEduNet),"22 Jan 2021","2020","","","1","8","The full stack logging service provided by Elastic™ has become a powerful tool within the highperformance computing community due to its ease of use, lightweight impact on the machines, performance speeds, and scalability. In the current work, we attempt to deploy such a stack on a server inside our department, which will be used for ingesting, parsing, and analyzing logs coming from multiple clusters. By analyzing the overall performance of each machine that is under continuous monitoring, we can provide immediate support in case of any issues that might occur, and more importantly, we can improve the computing power of our clusters through optimizations in terms of system management, networking, and other specific features.","2247-5443","978-0-7381-1265-7","10.1109/RoEduNet51892.2020.9324856","Ministry of Education and Research (MER)(grant numbers:7/2020(PN3-5.2-CERN-RO),PN19060205); European Regional Development Fund(grant numbers:CECBID-EOSC (POC/397/1/1-124405)); ","https://ieeexplore.ieee.org/stamp/stamp.jsp?arnumber=9324856","Elasticsearch;Kibana;Logstash;pipelines;logs;metrics;clusters;compute notes;Kubernetes","Servers;Pipelines;Measurement;Tools;Testing;Monitoring;Data visualization","","2","","27","IEEE","22 Jan 2021","","","IEEE","IEEE Conferences"
"A Step Towards Hadoop Dynamic Scaling","Q. Fu; N. Timkovich; P. Riteau; K. Keahey","Department of Computer Science, Boston University, Boston, USA; University of Chicago, Chicago, USA; University of Chicago, Chicago, USA; Argonne National Laboratory, Lemont, USA",2018 IEEE 20th International Conference on High Performance Computing and Communications; IEEE 16th International Conference on Smart City; IEEE 4th International Conference on Data Science and Systems (HPCC/SmartCity/DSS),"24 Jan 2019","2018","","","67","74","Many application portals successfully manage to scale elastically in order to provide a stable response time by integrating on-demand cloud resources. This is more challenging for applications that have to manage a dynamic configuration. Our paper investigates the question: under what circumstances (if any) dynamically adding more nodes to the Hadoop computation will result in performance improvement On one hand, if we add more nodes to a Hadoop computation, the computation will potentially finish faster since more computational power will be brought to bear on the problem. On the other hand, ensuring that we can use those nodes effectively may require data redistribution, thus creating additional overhead which may obviate any performance advantages. In this paper, we identified the container allocation as a key factor that affects Hadoop performance. Moreover, to mitigate the overhead, we describe and evaluate three methods for data redistribution in this use case and discuss their advantages and disadvantages.","","978-1-5386-6614-2","10.1109/HPCC/SmartCity/DSS.2018.00041","","https://ieeexplore.ieee.org/stamp/stamp.jsp?arnumber=8622779","Hadoop, Dynamic scaling, Geospatial processing, Cloud computing","Economics;Containers;Monitoring;Dynamic scheduling;Resource management;Yarn;Measurement","","3","","28","IEEE","24 Jan 2019","","","IEEE","IEEE Conferences"
"Rusty: Runtime Interference-Aware Predictive Monitoring for Modern Multi-Tenant Systems","D. Masouros; S. Xydis; D. Soudris","Department of Electrical and Computer Engineering, National Technical University of Athens, Athens, Greece; Department of Electrical and Computer Engineering, National Technical University of Athens, Athens, Greece; Department of Electrical and Computer Engineering, National Technical University of Athens, Athens, Greece",IEEE Transactions on Parallel and Distributed Systems,"18 Aug 2020","2021","32","1","184","198","Modern micro-service and container-based cloud-native applications have leveraged multi-tenancy as a first class system design concern. The increasing number of co-located services/workloads into server facilities stresses resource availability and system capability in an unconventional and unpredictable manner. To efficiently manage resources in such dynamic environments, run-time observability and forecasting are required to capture workload sensitivities under differing interference effects, according to applied co-location scenarios. While several research efforts have emerged on interference-aware performance modelling, they are usually applied at a very coarse-grained manner e.g., estimating the overall performance degradation of an application, thus failing to effectively quantify, predict or provide educated insights on the impact of continuous runtime interference on per-resource allocations. In this paper, we present Rusty, a predictive monitoring system that leverages the power of Long Short-Term Memory networks to enable fast and accurate runtime forecasting of key performance metrics and resource stresses of cloud-native applications under interference. We evaluate Rusty under a diverse set of interference scenarios for a plethora of representative cloud workloads, showing that Rusty i) achieves extremely high prediction accuracy, average R2 value of 0.98, ii) enables very deep prediction horizons retaining high accuracy, e.g., R2 of around 0.99 for a horizon of 1 sec ahead and around 0.94 for an horizon of 5 sec ahead, while iii) satisfying, at the same time, the strict latency constraints required to make Rusty practical for continuous predictive monitoring at runtime.","1558-2183","","10.1109/TPDS.2020.3013948","European Union's Horizon 2020 Research and Innovation programme(grant numbers:825061); ","https://ieeexplore.ieee.org/stamp/stamp.jsp?arnumber=9158547","predictive monitoring;system predictability;LSTM networks;interference aware;multi-tenant systems","Monitoring;Interference;Runtime;Resource management;Measurement;Degradation;Servers","","34","","88","IEEE","4 Aug 2020","","","IEEE","IEEE Journals"
