"Autoscaling Pods on an On-Premise Kubernetes Infrastructure QoS-Aware","L. M. Ruíz; P. P. Pueyo; J. Mateo-Fornés; J. V. Mayoral; F. S. Tehàs","Department of Computer Science and INSPIRES, University of Lleida, Lleida, Spain; Department of Computer Science and INSPIRES, University of Lleida, Lleida, Spain; Department of Computer Science and INSPIRES, University of Lleida, Lleida, Spain; Department of Computer Science and INSPIRES, University of Lleida, Lleida, Spain; Department of Computer Science and INSPIRES, University of Lleida, Lleida, Spain",IEEE Access,"30 Mar 2022","2022","10","","33083","33094","Cloud systems and microservices are becoming powerful tools for businesses. The evidence of the advantages of offering infrastructure, hardware or software as a service (IaaS, PaaS, SaaS) is overwhelming. Microservices and decoupled applications are increasingly popular. These architectures, based on containers, have facilitated the efficient development of complex SaaS applications. A big challenge is to manage and design microservices with a massive range of different facilities, from processing and data storage to computing predictive and prescriptive analytics. Computing providers are mainly based on data centers formed of massive and heterogeneous virtualized systems, which are continuously growing and diversifying over time. Moreover, these systems require integrating into current systems while meeting the Quality of Service (QoS) constraints. The primary purpose of this work is to present an on-premise architecture based on Kubernetes and Docker containers aimed at improving QoS regarding resource usage and service level objectives (SLOs). The main contribution of this proposal is its dynamic autoscaling capabilities to adjust system resources to the current workload while improving QoS.","2169-3536","","10.1109/ACCESS.2022.3158743","Intelligent Energy Europe (IEE) program and the Ministerio de Economía y Competitividad(grant numbers:PID2020-113614RB-C22); MCIN/AEI/10.1H6 network TIN2016-81840-REDT; ","https://ieeexplore.ieee.org/stamp/stamp.jsp?arnumber=9732997","Cloud;microservices;Kubernetes;SLO;QoS","Quality of service;Containers;Cloud computing;Monitoring;Measurement;Microservice architectures;Computer architecture","","17","","36","CCBY","10 Mar 2022","","","IEEE","IEEE Journals"
"On Energy-aware and Verifiable Benchmarking of Big Data Processing targeting AI Pipelines","G. Theodorou; S. Karagiorgou; C. Kotronis","UBITECH Ltd, Limassol, Cyprus; UBITECH Ltd, Limassol, Cyprus; UBITECH Ltd, Limassol, Cyprus",2024 IEEE International Conference on Big Data (BigData),"16 Jan 2025","2024","","","3788","3798","As Artificial Intelligence (AI) is revolutionizing various industries and applications, understanding the hardware requirements and energy consumption of AI pipelines in Big Data (BD) applications has become increasingly essential. This paper presents a comprehensive, scalable framework, designed to systematically measure hardware resources, energy usage, and model performance across two prominent data modalities: tabular data and images. The framework is generalizable, facilitating replicability across the AI research community, and encourages the deployment of AI models with comprehensive metrics beyond traditional accuracy, promoting the optimization of pipelines for real-world scenarios. Through detailed benchmarking, we identify EfficientNet as a standout model for image classification, and XGBoost for tabular data, both excelling in their respective domains. Notably, our findings show that Graphics Processing Units (GPUs) account for approximately 90% of total energy consumption in image-based tasks, while Central Processing Units (CPUs) are responsible for around 50% of energy use in tabular data processing. The merit of our innovative proposed framework combines information theory and probability theory to enhance our understanding of AI model performance in Edge-to-Cloud (E2C) applications that demand efficient Big Data processing in distributed environments. By seamlessly integrating energy efficiency with hardware optimization, it enables realtime monitoring of energy consumption and computing resources in containerized environments, providing precise insights for optimizing AI workloads. This framework facilitates scalable AI deployment on resource-constrained edge devices, reducing energy consumption while enhancing AI model robustness and interpretability, thereby promoting greater trust and transparency in AI-powered decision-making for critical real-world applications. This emphasizes the importance of multi-objective optimization for more sustainable and efficient Big Data AI workflows.","2573-2978","979-8-3503-6248-0","10.1109/BigData62323.2024.10826014","Horizon Europe; European Defence Fund; ","https://ieeexplore.ieee.org/stamp/stamp.jsp?arnumber=10826014","Big Data AI pipelines’ benchmarking;AI theoretical framework for edge-to-cloud applications;energy-aware AI pipelines for optimal model placement","Energy consumption;Analytical models;Accuracy;Pipelines;Big Data;Benchmark testing;Data models;Hardware;Artificial intelligence;Monitoring","","1","","41","IEEE","16 Jan 2025","","","IEEE","IEEE Conferences"
"Workload Prediction over Cloud Server using Time Series Data","M. P. Yadav; N. Pal; D. K. Yadav","Computer Science and Engineering, MNNIT Allahabad, Prayagraj, India; Computer Science and Engineering, MNNIT Allahabad, Prayagraj, India; Computer Science and Engineering, MNNIT Allahabad, Prayagraj, India","2021 11th International Conference on Cloud Computing, Data Science & Engineering (Confluence)","15 Mar 2021","2021","","","267","272","Analyzing and interpreting the real time data is a challenging task for cloud analysts (e.g. cloud providers) in cur-rent scenario for allocating computing resources in applications. Availability of a massive amount of data for processing over a server, cloud providers use the time series analysis models to analyze it. Based on the analysis, cloud providers allocate cloud resources (e.g., container machines) to manage the workload. Predictive analysis of data is important to identify the future trends and it also enables cloud organizations to act as per the demand of workload. It can be applied in different areas such as stock prices prediction, weather forecasting, and traffic load over the server (cloud computing). Cloud providers use this predictive analysis to avoid different types of losses such as services unavailability, maximum energy consumption and customer's loss. One of the methods to do predictive analysis using time series data is long short-term memory (LSTM). This paper presents a predictive analysis of time series forecasting using deep learning method (LSTM) to predict the future load over servers. The prediction accuracy of LSTM has been measured using three metrics -RMSE, MSE and MAE.","","978-1-6654-1451-7","10.1109/Confluence51648.2021.9377032","","https://ieeexplore.ieee.org/stamp/stamp.jsp?arnumber=9377032","Cloud Computing;Elasticity;Auto-scaling;Time Series Data;ARIMA;LSTM","Cloud computing;Time series analysis;Weather forecasting;Telecommunication traffic;Servers;Predictive analytics;Task analysis","","18","","23","IEEE","15 Mar 2021","","","IEEE","IEEE Conferences"
"Predictive Scaling of Elastic Pod Instances for Modern Applications on Public Cloud through Long Short-Term Memory","G. Bharanidharan; S. Jayalakshmi; P. Mayilvahanan","Dept. of Computer Science, VISTAS, Pallavaram, Chennai; Dept. of Computer Science and Engineering, Vel Tech Multi Tech Dr.Rangarajan Dr.Sakunthala Engineering College, Chennai; Dept. of Computer Science, VISTAS, Pallavaram, Chennai",2022 International Conference on Applied Artificial Intelligence and Computing (ICAAIC),"16 Jun 2022","2022","","","1710","1717","In Cloud Computing (CC) environment, container virtualization through Docker engine is bringing the new digital transformation in the enterprise multi-tier application architecture in this modern era. Elastic pod containers attracts and helps the application developers in developing and executing the cloud-native modern applications with key benefits such as light weight, agility to launch, easy deployment through images, consuming less power, minimum cost, less carbon footprints with increased resource utilization and provisioning on public cloud data centers. In existing, reactive auto-scaling mechanism of pod resources is used to add or remove resources manually or rule based for handling static workloads from users and most of the times it may lead to over provision or under provisioning of instances that violates QOS and SLA. In this paper, predictive horizontal scaling of pods utilizing custom metrics with orchestration through Kuberenetes is proposed with LSTM (Long Short-Term Memory) based on Deep Learning (DL) technique. DL is data hungry for right prediction of replicas of a cluster that is needed in advance to run cyclic workloads and to handle the sudden spike of demand by using the cloud large dataset real time traces. Moreover, LSTM model is compared with GRU (Gated Recurrent Unit) and experimental results shows that the results of LSTM prediction has less absolute error rate on comparing with GRU to keep the resource provisioning accuracy better for running the modern workloads seamlessly on public cloud.","","978-1-6654-9710-7","10.1109/ICAAIC53929.2022.9792749","","https://ieeexplore.ieee.org/stamp/stamp.jsp?arnumber=9792749","Container Virtu aliza tion;Pods;Predictive Scaling;Replicas;Agility;Elasticity;Cloud-native applications","Measurement;Cloud computing;Error analysis;Quality of service;Containers;Predictive models;Logic gates","","","","22","IEEE","16 Jun 2022","","","IEEE","IEEE Conferences"
"PM$^{2}$2VE: Power Metering Model for Virtualization Environments in Cloud Data Centers","Z. Shen; X. Zhang; Z. Liu; Y. Li","School of Computer Science, Nanjing University of Posts and Telecommunications, Nanjing, China; School of Computer Science, Nanjing University of Posts and Telecommunications, Nanjing, China; School of Computer Science, Nanjing University of Posts and Telecommunications, Nanjing, China; Jiangsu Key Laboratory for Big Data Security and Intelligent Processing, School of Computer Science, Nanjing University of Posts and Telecommunications, Nanjing, China",IEEE Transactions on Cloud Computing,"5 Sep 2023","2023","11","3","3126","3138","Virtualization technologies provide solutions for cloud computing. Virtual resource scheduling is a crucial task in data centers, and the power consumption of virtual resources is a critical foundation of virtualization scheduling. Containers are the smallest unit of virtual resource scheduling and migration. Although many practical models for estimating the power consumption of virtual machines (VMs) have been proposed, few power estimation models of containers have been put forth. In this article, we propose a fast-training piecewise regression model based on a decision tree for VM power metering and estimate the power of containers configured on the VM by treating the container as a group of processes on the VM. We select appropriate features from the collected metrics of VMs/containers to help our model fit the nonlinear relationship between power and features well. Besides, we optimize the leaf nodes of the regression tree, realizing the effective power metering of virtualization environments. We evaluate the proposed model on 13 tasks in PARSEC and compare it with several commonly used models in data centers. The experimental results prove the effectiveness of the proposed model, and the estimated power of containers is in line with expectations.","2168-7161","","10.1109/TCC.2023.3262648","National Key Research and Development Program of China(grant numbers:2018YFB1003702); Key University Natural Science Research Project of Jiangsu Province(grant numbers:21KJA520003); National Natural Science Foundation of China(grant numbers:61772284); Graduate Research and Innovation Projects of Jiangsu Province(grant numbers:KYCX20_0760); ","https://ieeexplore.ieee.org/stamp/stamp.jsp?arnumber=10083249","Container;data center;power estimation;virtual machine","Containers;Data centers;Power demand;Estimation;Data models;Virtualization;Servers","","2","","46","IEEE","28 Mar 2023","","","IEEE","IEEE Journals"
"Efficient Microservice Deployment in the Edge-Cloud Networks With Policy-Gradient Reinforcement Learning","K. Afachao; A. M. Abu-Mahfouz; G. P. Hanke","Department of Electrical, Electronic and Computer Engineering, University of Pretoria, Pretoria, South Africa; Department of Electrical, Electronic and Computer Engineering, University of Pretoria, Pretoria, South Africa; Department of Computer Science, City University of Hong Kong, Hong Kong, SAR",IEEE Access,"30 Sep 2024","2024","12","","133110","133124","The rise of user-centric design demands ubiquitous access to infrastructure and applications, facilitated by the Edge-Cloud network and microservices. However, efficiently managing resource allocation while orchestrating microservice placement in such dynamic environments presents a significant challenge. These challenges stem from the limited resources of edge devices, the need for low latency responses, and the potential for performance degradation due to service failures or inefficient deployments. This paper addresses the challenge of microservice placement in Edge-Cloud environments by proposing a novel Reinforcement Learning algorithm called Bi-Generic Advantage Actor-Critic for Microservice Placement Policy. This algorithm’s ability to learn and adapt to the dynamic environment makes it well-suited for optimizing resource allocation and service placement decisions within the Edge-Cloud. We compare this algorithm against three baseline algorithms through simulations on a real-world dataset, evaluating performance metrics such as execution time, network usage, average migration delay, and energy consumption. The results demonstrate the superiority of the proposed method, with an 8% reduction in execution time, translating to faster response times for users. Additionally, it achieves a 4% decrease in network usage and a 2% decrease in energy consumption compared to the best-performing baseline. This research contributes by reproducing the Edge-Cloud environment, applying the novel Bi-Generic Advantage Actor-Critic technique, and demonstrating significant improvements over the state-of-the-art baseline algorithms in microservice placement and resource management within Edge-Cloud environments.","2169-3536","","10.1109/ACCESS.2024.3461149","Telkom, South Africa; ","https://ieeexplore.ieee.org/stamp/stamp.jsp?arnumber=10680533","Edge computing;microservices;network optimization;online placement;scheduling algorithms;reinforcement learning","Microservice architectures;Heuristic algorithms;Reliability;Optimization methods;Resource management;Containers;Edge computing;Scheduling;User centered design;Reinforcement learning","","6","","32","CCBYNCND","16 Sep 2024","","","IEEE","IEEE Journals"
"Container Image Similarity-Aware Resource Provisioning for Serverless Edge Computing","A. Zhou; S. Li; X. Ma; Y. Zhang; S. Wang","State Key Laboratory of Network and Switching Technology, Beijing University of Posts and Telecommunications, Beijing, China; State Key Laboratory of Network and Switching Technology, Beijing University of Posts and Telecommunications, Beijing, China; State Key Laboratory of Network and Switching Technology, Beijing University of Posts and Telecommunications, Beijing, China; State Key Laboratory of Network and Switching Technology, Beijing University of Posts and Telecommunications, Beijing, China; State Key Laboratory of Network and Switching Technology, Beijing University of Posts and Telecommunications, Beijing, China",2023 IEEE International Conference on Web Services (ICWS),"19 Sep 2023","2023","","","278","288","Container-enabled serverless computing has become a widely adopted approach for resource provisioning in the edge cloud. However, traffic incurred by container image pulling heavily burdens the already congested back-haul network. To relieve the problem, we do an analysis on Docker Hub, and find that instance deployment strategy has a significant impact on the back-haul traffic due to the varying similarity levels of different images. We incorporate this feature into task offloading decision and resource provisioning, and formulate the problem with a mixed integer non-linear programming (MINLP) problem. To address the challenges arising from the coupling and contradiction of instance deployment, image pulling, offloading decision, and resource allocation, we employ multi-agent deep reinforcement learning to decompose the problem into several simpler sub-problems, and design an algorithm for each sub-problem individually by exploiting convex optimization and fractional programming techniques. Simulations are conducted to validate the effectiveness of the proposed algorithm. The experiment results illustrate that our algorithm outperforms current notable solutions and improves the global utility by 13%–74%.","2836-3868","979-8-3503-0485-5","10.1109/ICWS60048.2023.00047","","https://ieeexplore.ieee.org/stamp/stamp.jsp?arnumber=10248269","Edge computing;Offloading;Container image;Resource provisioning;Instance deployment.","Deep learning;Web services;Image edge detection;Computational modeling;Serverless computing;Reinforcement learning;Programming","","2","","35","IEEE","19 Sep 2023","","","IEEE","IEEE Conferences"
"Scheduling Latency-Sensitive Tasks in the Cloud Continuum with Hierarchical Reinforcement Learning","D. Monaco; A. Sacco; C. Casetti; G. Marchetto","Department of Control and Computer Engineering, Politecnico di Torino, Italy; Department of Control and Computer Engineering, Politecnico di Torino, Italy; Department of Control and Computer Engineering, Politecnico di Torino, Italy; Department of Control and Computer Engineering, Politecnico di Torino, Italy",NOMS 2025-2025 IEEE Network Operations and Management Symposium,"15 Jul 2025","2025","","","01","09","Service orchestrators such as Kubernetes are widely employed to automate the handling and scheduling of workloads, which involves determining the most suitable physical node on which to start a new task. The expanding application of Machine Learning (ML) algorithms, and in particular Reinforcement Learning (RL), opens up new development opportunities to make runtime decisions that can account for multiple metrics and varying network conditions. However, current RL-based solutions are unable to fit the growing complexity of distributed applications and infrastructure, characterized by a more heterogeneous resource continuum and the increasing need to minimize energy consumption while satisfying tasks' requirements. To fill this gap, we propose RL-ICE as an innovative scheduler that can work in such a cloud continuum by leveraging a multi-cluster and hierarchical RL to satisfy both user Quality of Experience (QoE) metrics and tenant's costs. We test RL-ICE in a simulated large-scale environment and in a real-world Kubernetes setup. In both scenarios, our solution effectively balances user-perceived latency, energy consumption, and deployment costs. Additionally, RL-ICE can dynamically respond to network failures by migrating microservices to maintain efficient management of resources.","2374-9709","979-8-3315-3163-8","10.1109/NOMS57970.2025.11073729","","https://ieeexplore.ieee.org/stamp/stamp.jsp?arnumber=11073729","Kubernetes;Scheduling;Reinforcement Learning","Measurement;Energy consumption;Costs;Runtime;Machine learning algorithms;Processor scheduling;Microservice architectures;Reinforcement learning;Quality of experience;Optimization","","","","41","IEEE","15 Jul 2025","","","IEEE","IEEE Conferences"
"Kube-Knots: Resource Harvesting through Dynamic Container Orchestration in GPU-based Datacenters","P. Thinakaran; J. R. Gunasekaran; B. Sharma; M. T. Kandemir; C. R. Das","The Pennsylvania State University; The Pennsylvania State University; Facebook, Inc.; The Pennsylvania State University; The Pennsylvania State University",2019 IEEE International Conference on Cluster Computing (CLUSTER),"7 Nov 2019","2019","","","1","13","Compute heterogeneity is increasingly gaining prominence in modern datacenters due to the addition of accelerators like GPUs and FPGAs. We observe that datacenter schedulers are agnostic of these emerging accelerators, especially their resource utilization footprints, and thus, not well equipped to dynamically provision them based on the application needs. We observe that the state-of-the-art datacenter schedulers fail to provide fine-grained resource guarantees for latency-sensitive tasks that are GPU-bound. Specifically for GPUs, this results in resource fragmentation and interference leading to poor utilization of allocated GPU resources. Furthermore, GPUs exhibit highly linear energy efficiency with respect to utilization and hence proactive management of these resources is essential to keep the operational costs low while ensuring the end-to-end Quality of Service (QoS) in case of user-facing queries.Towards addressing the GPU orchestration problem, we build Knots, a GPU-aware resource orchestration layer and integrate it with the Kubernetes container orchestrator to build Kube- Knots. Kube-Knots can dynamically harvest spare compute cycles through dynamic container orchestration enabling co-location of latency-critical and batch workloads together while improving the overall resource utilization. We design and evaluate two GPU-based scheduling techniques to schedule datacenter-scale workloads through Kube-Knots on a ten node GPU cluster. Our proposed Correlation Based Prediction (CBP) and Peak Prediction (PP) schemes together improves both average and 99th percentile cluster-wide GPU utilization by up to 80% in case of HPC workloads. In addition, CBP+PP improves the average job completion times (JCT) of deep learning workloads by up to 36% when compared to state-of-the-art schedulers. This leads to 33% cluster-wide energy savings on an average for three different workloads compared to state-of-the-art GPU-agnostic schedulers. Further, the proposed PP scheduler guarantees the end-to-end QoS for latency-critical queries by reducing QoS violations by up to 53% when compared to state-of-the-art GPU schedulers.","2168-9253","978-1-7281-4734-5","10.1109/CLUSTER.2019.8891040","","https://ieeexplore.ieee.org/stamp/stamp.jsp?arnumber=8891040","","Graphics processing units;Containers;Measurement;Task analysis;Quality of service;Resource management;Correlation","","27","","64","IEEE","7 Nov 2019","","","IEEE","IEEE Conferences"
"Towards Prediction of Power Consumption of Virtual Machines for Varying Loads","H. A. Salam; F. Davoli; A. Carrega; A. Timm-Giel","DITEN - University of Genoa, Genoa, Italy; DITEN - University of Genoa, Genoa, Italy; CNIT - S3ITI Lab, Genoa, Italy; Hamburg University of Technology, Institute of Communication Networks, Hamburg, Germany",2018 28th International Telecommunication Networks and Applications Conference (ITNAC),"17 Jan 2019","2018","","","1","6","Power management and load balancing in data centers are becoming critical with the growing size of the infrastructure. In front of an increasing number of cloud networks, virtual machines (VMs) and containers, smart management and control decisions are required, in order to instantiate or mobilize these virtual components. As regards reducing power consumption, it is also essential to consolidate virtual resources on the minimum possible number of servers compatible with performance requirements. In such a dynamic scenario, estimating the power that can be ascribed to a specific virtual component and its relation with the offered workload could be beneficial for optimized resource scheduling. Predicting the power consumption caused by a specific virtual component is however challenging. In this paper, two power models that relate a VM workload with the fraction of power consumed attributable to the VM are developed based on power profiling of a server. The accuracy of the proposed models is improved approximately by 3% compared to other existing models.","2474-154X","978-1-5386-7177-1","10.1109/ATNAC.2018.8615319","","https://ieeexplore.ieee.org/stamp/stamp.jsp?arnumber=8615319","Virtual machine;power modeling;regression model;power profiling","Servers;Load modeling;Virtual machining;Power measurement;Predictive models;Power demand;Data models","","5","","18","IEEE","17 Jan 2019","","","IEEE","IEEE Conferences"
